{
  "entry_id": "lde_TILH00000042",
  "ledger_id": "ldg_ANNAxTILH0001",
  "seq": 42,
  "type": "payment",
  "amount": {
    "value": 42105000,
    "currency": "INR"
  },
  "effect": "decrease_receivable",
  "at": "2026-11-17T12:00:00+05:30",
  "settles": [
    {
      "entry_id": "lde_TILH00000041",
      "amount": {
        "value": 42105000,
        "currency": "INR"
      }
    }
  ],
  "settlement_evidence": {
    "handler": "in.a2a.neft",
    "receipt_id": "rcpt_NEFT00000001",
    "utr": "UTIBN26321000045"
  },
  "ledger_after": {
    "balance": {
      "value": 0,
      "currency": "INR"
    },
    "credit_limit": {
      "value": 100000000,
      "currency": "INR"
    },
    "overdue": {
      "value": 0,
      "currency": "INR"
    }
  },
  "acknowledgements": [
    {
      "by": "seller",
      "method": "auto_from_rail_receipt",
      "at": "2026-11-17T12:05:00+05:30"
    }
  ],
  "status": "settled",
  "prev_hash": "sha-256:2j76-F435SKJwqHuMivnGIyVn2QjD-8_t2gJjvOWAAA",
  "entry_hash": "sha-256:iq9WucgZVLwI0vlPZG934NQiD5abHJmTmVxV0O32tXc",
  "signatures": [
    {
      "role": "bap",
      "kid": "bap.annapurna.example.in|k1",
      "alg": "ES256",
      "value": "eyJhbGciOiJFUzI1NiJ9.eyJiYWNwIjoidjEifQ.c2lnbmF0dXJl"
    }
  ]
}
